[{
	"index": 0,
	"title": "Gmail",
	"url": "https://accounts.google.com/b/0/AddMailService",
	"id": 8,
	"parentId": "1",
	"dateAddedLocal": "18/09/2022, 12:52:45",
	"dateAddedUTC": "2022-09-18T07:22:45.225Z"
},{
	"index": 1,
	"title": "YouTube",
	"url": "https://youtube.com/",
	"id": 9,
	"parentId": "1",
	"dateAddedLocal": "18/09/2022, 12:52:45",
	"dateAddedUTC": "2022-09-18T07:22:45.227Z"
},{
	"index": 2,
	"title": "Maps",
	"url": "https://maps.google.com/",
	"id": 10,
	"parentId": "1",
	"dateAddedLocal": "18/09/2022, 12:52:45",
	"dateAddedUTC": "2022-09-18T07:22:45.227Z"
},{
	"index": 3,
	"title": "Translate",
	"url": "https://translate.google.com/",
	"id": 11,
	"parentId": "1",
	"dateAddedLocal": "23/02/2020, 01:57:25",
	"dateAddedUTC": "2020-02-22T20:27:25.669Z"
},{
	"index": 4,
	"title": "Admin, person, user, man Free Icon of Free Large Boss",
	"url": "https://icon-icons.com/icon/admin-person-user-man/2284",
	"id": 12,
	"parentId": "1",
	"dateAddedLocal": "29/02/2020, 21:36:00",
	"dateAddedUTC": "2020-02-29T16:06:00.214Z"
},{
	"index": 5,
	"title": "Django Deployment - Digital Ocean",
	"url": "https://gist.github.com/bradtraversy/cfa565b879ff1458dba08f423cb01d71",
	"id": 13,
	"parentId": "1",
	"dateAddedLocal": "18/03/2020, 23:54:56",
	"dateAddedUTC": "2020-03-18T18:24:56.576Z"
},{
	"index": 6,
	"title": "Geoff Thomas - Software Engineer",
	"url": "http://www.thomasgeoff.com/",
	"id": 14,
	"parentId": "1",
	"dateAddedLocal": "20/03/2020, 02:21:44",
	"dateAddedUTC": "2020-03-19T20:51:44.933Z"
},{
	"index": 7,
	"title": "The best SaaS landing page examples for design inspiration - SaaS Landing Page",
	"url": "https://saaslandingpage.com/",
	"id": 15,
	"parentId": "1",
	"dateAddedLocal": "06/04/2020, 01:56:48",
	"dateAddedUTC": "2020-04-05T20:26:48.177Z"
},{
	"index": 8,
	"title": "Eduardo Ochs (a.k.a. Edrx) - Personal Stuff",
	"url": "http://angg.twu.net/tmp-b.html",
	"id": 16,
	"parentId": "1",
	"dateAddedLocal": "15/04/2020, 09:45:55",
	"dateAddedUTC": "2020-04-15T04:15:55.970Z"
},{
	"index": 9,
	"title": "DEVICON | All programming languages and development tools related icons font",
	"url": "https://konpa.github.io/devicon/",
	"id": 17,
	"parentId": "1",
	"dateAddedLocal": "16/04/2020, 02:03:01",
	"dateAddedUTC": "2020-04-15T20:33:01.695Z"
},{
	"index": 10,
	"title": "Friends – JetBrains Academy",
	"url": "https://hyperskill.org/friends",
	"id": 18,
	"parentId": "1",
	"dateAddedLocal": "26/07/2020, 09:28:33",
	"dateAddedUTC": "2020-07-26T03:58:33.660Z"
},{
	"index": 11,
	"title": "Files of coursedownloader",
	"url": "https://uploadcenter.com/users/coursedownloader",
	"id": 19,
	"parentId": "1",
	"dateAddedLocal": "13/09/2020, 21:30:22",
	"dateAddedUTC": "2020-09-13T16:00:22.308Z"
},{
	"index": 12,
	"title": "Topic wise multiple choice questions in computer science",
	"url": "https://www.geeksforgeeks.org/quiz-corner-gq/",
	"id": 20,
	"parentId": "1",
	"dateAddedLocal": "09/11/2020, 14:28:29",
	"dateAddedUTC": "2020-11-09T08:58:29.107Z"
},{
	"index": 13,
	"title": "Green Screen Tracking Compositing Using After Effects - YouTube",
	"url": "https://www.youtube.com/watch?v=LZrCSU4TEG0",
	"id": 21,
	"parentId": "1",
	"dateAddedLocal": "12/01/2021, 03:30:56",
	"dateAddedUTC": "2021-01-11T22:00:56.755Z"
},{
	"index": 14,
	"title": "Unicode to Kruti Dev यूनिकोड = कृतिदेव Converter",
	"url": "https://www.unicodetokrutidev.com/",
	"id": 22,
	"parentId": "1",
	"dateAddedLocal": "13/01/2021, 18:17:00",
	"dateAddedUTC": "2021-01-13T12:47:00.253Z"
},{
	"index": 15,
	"title": "Bootstrap Glyphicons v3.3.7 | Bootstrap Cheat Sheets",
	"url": "https://glyphicons.bootstrapcheatsheets.com/#",
	"id": 23,
	"parentId": "1",
	"dateAddedLocal": "16/01/2021, 11:24:26",
	"dateAddedUTC": "2021-01-16T05:54:26.895Z"
},{
	"index": 16,
	"title": "Free vector icons - SVG, PSD, PNG, EPS & Icon Font - Thousands of free icons",
	"url": "https://www.flaticon.com/",
	"id": 24,
	"parentId": "1",
	"dateAddedLocal": "22/02/2021, 18:32:10",
	"dateAddedUTC": "2021-02-22T13:02:10.180Z"
},{
	"index": 17,
	"title": "TOP 5 WEBSITES EVERY WEB DESIGNER SHOULD VISIT: Mind-blowing web design | March 2020 - YouTube",
	"url": "https://www.youtube.com/watch?v=AmHEfTSBXiY",
	"id": 25,
	"parentId": "1",
	"dateAddedLocal": "27/02/2021, 15:27:18",
	"dateAddedUTC": "2021-02-27T09:57:18.993Z"
},{
	"index": 18,
	"title": "iLovePDF | Online PDF tools for PDF lovers",
	"url": "https://www.ilovepdf.com/",
	"id": 26,
	"parentId": "1",
	"dateAddedLocal": "01/03/2021, 09:29:47",
	"dateAddedUTC": "2021-03-01T03:59:47.046Z"
},{
	"index": 19,
	"title": "10 Code Snippets for Creating Responsive Navigation Menus",
	"url": "https://1stwebdesigner.com/code-snippets-responsive-navigation-menu/",
	"id": 27,
	"parentId": "1",
	"dateAddedLocal": "02/03/2021, 15:11:39",
	"dateAddedUTC": "2021-03-02T09:41:39.148Z"
},{
	"index": 20,
	"title": "Lusion",
	"url": "https://lusion.co/contact",
	"id": 28,
	"parentId": "1",
	"dateAddedLocal": "02/03/2021, 17:42:22",
	"dateAddedUTC": "2021-03-02T12:12:22.221Z"
},{
	"index": 21,
	"title": "weqsx",
	"url": "http://127.0.0.1:5500/gallery.html",
	"id": 29,
	"parentId": "1",
	"dateAddedLocal": "08/03/2021, 16:51:02",
	"dateAddedUTC": "2021-03-08T11:21:02.459Z"
},{
	"index": 22,
	"title": "DesignValley | The Ultimate Design Tool",
	"url": "https://designvalley.club/",
	"id": 30,
	"parentId": "1",
	"dateAddedLocal": "09/03/2021, 16:09:23",
	"dateAddedUTC": "2021-03-09T10:39:23.452Z"
},{
	"index": 23,
	"title": "justdjango/django-ecommerce: An e-commerce website built with Django",
	"url": "https://github.com/justdjango/django-ecommerce",
	"id": 31,
	"parentId": "1",
	"dateAddedLocal": "11/03/2021, 13:20:00",
	"dateAddedUTC": "2021-03-11T07:50:00.588Z"
},{
	"index": 24,
	"title": "Neumorphism/Soft UI CSS shadow generator",
	"url": "https://neumorphism.io/#001f3f",
	"id": 32,
	"parentId": "1",
	"dateAddedLocal": "12/03/2021, 12:49:15",
	"dateAddedUTC": "2021-03-12T07:19:15.725Z"
},{
	"index": 25,
	"title": "Glassmorphism CSS Generator",
	"url": "https://glassmorphism.com/",
	"id": 33,
	"parentId": "1",
	"dateAddedLocal": "12/03/2021, 13:03:21",
	"dateAddedUTC": "2021-03-12T07:33:21.185Z"
},{
	"index": 26,
	"title": "Bootstrap Snippet Transparent Sticky NavBar using HTML CSS jQuery",
	"url": "https://bootsnipp.com/snippets/kl8Q3",
	"id": 34,
	"parentId": "1",
	"dateAddedLocal": "13/03/2021, 11:59:57",
	"dateAddedUTC": "2021-03-13T06:29:57.558Z"
},{
	"index": 27,
	"title": "Best sellers for sports Template",
	"url": "https://nicepage.com/t/27240/best-sellers-for-sports-template",
	"id": 35,
	"parentId": "1",
	"dateAddedLocal": "15/03/2021, 18:36:00",
	"dateAddedUTC": "2021-03-15T13:06:00.901Z"
},{
	"index": 28,
	"title": "Refuel at power gym Template",
	"url": "https://nicepage.com/t/93543/refuel-at-power-gym-template",
	"id": 36,
	"parentId": "1",
	"dateAddedLocal": "15/03/2021, 18:36:09",
	"dateAddedUTC": "2021-03-15T13:06:09.117Z"
},{
	"index": 29,
	"title": "6500+ Templates | Free Templates 2021",
	"url": "https://nicepage.com/templates",
	"id": 37,
	"parentId": "1",
	"dateAddedLocal": "15/03/2021, 18:36:13",
	"dateAddedUTC": "2021-03-15T13:06:13.497Z"
},{
	"index": 30,
	"title": "Free Trial – Try Microsoft 365 for a month – Microsoft Store",
	"url": "https://www.microsoft.com/en-in/microsoft-365/try?ocid=oo_support_mix_marvel_ups_support_tryfloatie&rtc=1",
	"id": 38,
	"parentId": "1",
	"dateAddedLocal": "27/03/2021, 12:51:59",
	"dateAddedUTC": "2021-03-27T07:21:59.802Z"
},{
	"index": 31,
	"title": "Microsoft Office Home",
	"url": "https://www.office.com/?auth=1",
	"id": 39,
	"parentId": "1",
	"dateAddedLocal": "27/03/2021, 12:52:08",
	"dateAddedUTC": "2021-03-27T07:22:08.035Z"
},{
	"index": 32,
	"title": "Five ambient webpage backgrounds created using the HTML5 Canvas API and jwagner's Simplex Noise library.",
	"url": "https://github.com/crnacura/AmbientCanvasBackgrounds",
	"id": 40,
	"parentId": "1",
	"dateAddedLocal": "13/04/2021, 02:28:21",
	"dateAddedUTC": "2021-04-12T20:58:21.685Z"
},{
	"index": 33,
	"title": "flickr_gallery demo",
	"url": "https://nchelluri.neocities.org/",
	"id": 41,
	"parentId": "1",
	"dateAddedLocal": "15/04/2021, 02:00:47",
	"dateAddedUTC": "2021-04-14T20:30:47.337Z"
},{
	"index": 34,
	"title": "Bootstrap Gallery - examples & tutorial",
	"url": "https://mdbootstrap.com/docs/standard/extended/gallery/#!",
	"id": 42,
	"parentId": "1",
	"dateAddedLocal": "15/04/2021, 02:04:55",
	"dateAddedUTC": "2021-04-14T20:34:55.877Z"
},{
	"index": 35,
	"title": "Animated navbar - code helper",
	"url": "https://mdbootstrap.com/snippets/standard/mdbootstrap/2946064",
	"id": 43,
	"parentId": "1",
	"dateAddedLocal": "15/04/2021, 02:06:31",
	"dateAddedUTC": "2021-04-14T20:36:31.683Z"
},{
	"index": 36,
	"title": "toidicode/template: Share 100 templates HTML5 CSS3 for developer or beginner",
	"url": "https://github.com/toidicode/template",
	"id": 44,
	"parentId": "1",
	"dateAddedLocal": "18/04/2021, 12:35:28",
	"dateAddedUTC": "2021-04-18T07:05:28.438Z"
},{
	"index": 37,
	"title": "Bootstrap 4 Google Map - examples & tutorial. Basic & advanced usage - Material Design for Bootstrap",
	"url": "https://mdbootstrap.com/docs/b4/jquery/javascript/google-maps/",
	"id": 45,
	"parentId": "1",
	"dateAddedLocal": "07/05/2021, 13:23:37",
	"dateAddedUTC": "2021-05-07T07:53:37.914Z"
},{
	"index": 38,
	"title": "My projects | Renderforest",
	"url": "https://www.renderforest.com/profile/my-websites",
	"id": 46,
	"parentId": "1",
	"dateAddedLocal": "13/05/2021, 02:52:24",
	"dateAddedUTC": "2021-05-12T21:22:24.481Z"
},{
	"index": 39,
	"title": "css-protips/translations/es-ES at master · AllThingsSmitty/css-protips",
	"url": "https://github.com/AllThingsSmitty/css-protips/tree/master/translations/es-ES#utilizar-un-css-reset",
	"id": 47,
	"parentId": "1",
	"dateAddedLocal": "12/06/2021, 11:31:44",
	"dateAddedUTC": "2021-06-12T06:01:44.982Z"
},{
	"index": 40,
	"title": "web templates, CSS frameworks, UI libraries, tools and much more",
	"url": "https://github.com/bradtraversy/design-resources-for-developers",
	"id": 48,
	"parentId": "1",
	"dateAddedLocal": "12/06/2021, 11:42:35",
	"dateAddedUTC": "2021-06-12T06:12:35.651Z"
},{
	"index": 41,
	"title": "Chocolat - Responsive lightbox",
	"url": "http://chocolat.insipi.de/#demo",
	"id": 49,
	"parentId": "1",
	"dateAddedLocal": "12/06/2021, 11:44:13",
	"dateAddedUTC": "2021-06-12T06:14:13.233Z"
},{
	"index": 42,
	"title": "Tilt.js - A tiny parallax tilt effect for jQuery",
	"url": "http://gijsroge.github.io/tilt.js/",
	"id": 50,
	"parentId": "1",
	"dateAddedLocal": "12/06/2021, 11:44:55",
	"dateAddedUTC": "2021-06-12T06:14:55.262Z"
},{
	"index": 43,
	"title": "slick - the last carousel you'll ever need",
	"url": "https://kenwheeler.github.io/slick/",
	"id": 51,
	"parentId": "1",
	"dateAddedLocal": "12/06/2021, 11:51:00",
	"dateAddedUTC": "2021-06-12T06:21:00.609Z"
},{
	"index": 44,
	"title": "192.168.1.1/admin/login.asp",
	"url": "http://192.168.1.1/admin/login.asp",
	"id": 52,
	"parentId": "1",
	"dateAddedLocal": "16/07/2021, 13:41:01",
	"dateAddedUTC": "2021-07-16T08:11:01.699Z"
},{
	"index": 45,
	"title": "BasselTech - Redirect",
	"url": "https://basseltech.com/redirect?url=https%3A%2F%2Fjmp.sh%2FWz81wBV",
	"id": 53,
	"parentId": "1",
	"dateAddedLocal": "29/07/2021, 17:07:41",
	"dateAddedUTC": "2021-07-29T11:37:41.531Z"
},{
	"index": 46,
	"title": "javascript - Subscribe to Newsletter Form - Stack Overflow",
	"url": "https://stackoverflow.com/questions/22095078/subscribe-to-newsletter-form",
	"id": 54,
	"parentId": "1",
	"dateAddedLocal": "23/08/2021, 17:04:39",
	"dateAddedUTC": "2021-08-23T11:34:39.982Z"
},{
	"index": 47,
	"title": "Cordova App Templates - Apache Cordova",
	"url": "https://cordova.apache.org/docs/en/latest/guide/cli/template.html#use-a-template",
	"id": 55,
	"parentId": "1",
	"dateAddedLocal": "04/09/2021, 01:28:31",
	"dateAddedUTC": "2021-09-03T19:58:31.472Z"
},{
	"index": 48,
	"title": "18 amazing 🤩 GitHub repositories that will help you 🪄 make a Beautiful Project - DEV Community",
	"url": "https://dev.to/kerthin/18-amazing-github-repositories-that-will-help-you-make-a-beautiful-project-3pgo",
	"id": 56,
	"parentId": "1",
	"dateAddedLocal": "05/09/2021, 10:04:14",
	"dateAddedUTC": "2021-09-05T04:34:14.552Z"
},{
	"index": 49,
	"title": "Eduhome - Education HTML Template Preview - ThemeForest",
	"url": "https://preview.themeforest.net/item/eduhome-education-html-template/full_screen_preview/20805064?_ga=2.186455657.1598183320.1631185914-401554132.1611926922",
	"id": 57,
	"parentId": "1",
	"dateAddedLocal": "09/09/2021, 17:24:13",
	"dateAddedUTC": "2021-09-09T11:54:13.926Z"
}]
